"url_img","title","price"
"https://pos.nvncdn.com/eb9ddb-116318/ps/20220323_6oxLHeUye7EdYCS8qqbwhzWq.png","Áo Polo Fear Of God Essentials SS Polo String","1.350.000 ₫"
"https://pos.nvncdn.com/eb9ddb-116318/ps/20220323_SwEKJJNmjz7ybiiEFqd00oNu.png","Áo Sweater Fear Of God Essentials Pullover Mockneck Dark Heather Oatmeal","1.900.000 ₫"
"https://pos.nvncdn.com/eb9ddb-116318/ps/20220323_fRHX6vcvF0tqQxclAPTY48Bq.png","Quần Nike AS M NSW Club JGGR FT ‘Black’","2.100.000 ₫"
"https://pos.nvncdn.com/eb9ddb-116318/ps/20220323_HFTsYxmGNioC9DibHujmnGle.png","Quần Sweatshort Fear Of God Essentials Dark Heather Oatmeal","1.250.000 ₫"
"https://pos.nvncdn.com/eb9ddb-116318/ps/20220323_rQFbw7rf2n8cXtMXcqL4yWLB.png","Áo thun ADLV Baby Face Short Sleeve T-Shirt White Ice Cream","Liên hệ"
